"Domain","Instrument / Source","What it Measures"
"CU traits","Inventory of Callous-Unemotional Traits (ICU)","Lack of empathy, guilt, and emotional responsiveness"
"Empathy","Cognitive and Affective Empathy Questionnaire","Ability to understand and share others' emotions (cognitive vs affective empathy)"
"Aggression","Reactive-Proactive Aggression Questionnaire (RPQ)","Types of aggression: reactive (impulsive) vs proactive (planned)"
"Childhood trauma","Childhood Trauma Questionnaire (CTQ)","Adverse early experiences such as neglect, abuse, or maltreatment"
"Neural biomarkers","Simulated GMV, DTI connectivity, fMRI amygdala reactivity","Brain structure, connectivity, and emotional reactivity markers relevant to CU traits"
